 David, which of these topics do you think are applied to using a script? >> So I chose four of the seven as applied to using a script. So for problem reduction, we saw earlier that the script breaks down the overall scene into smaller scenes, and even further into smaller actions. What that means is that when we're executing the script, and it kind of gets caught somewhere we can break it down and see exactly where the script got caught. So we can see exactly where an expectation was violated. Classification we actually already discussed because classification can help us identify which script to execute in a given situation based on what we see. So if we walk into a restaurant and see a hostess for example we can classify that as a specific kind of restaurant and launch the script that goes along with it. Although it would take a bigger jump, I can also imagine putting a script in terms of formal logic. Especially because we discussed before, that a script can be considered a plan that has already been executed once, and can be transferred to new situations. So if we're discussing plans in the form of formal logic, we may also be able to put scripts in those same kind of terms. In terms of what they're asserting is true for a given state of the script. So if we could put plans in the form of formal logic, we can also imagine rewriting our script in the form of formal logic. That would give us a script in terms of what different elements of the script assert about the state of the world at different points of the script's execution. Finally, we can also see understanding applying pretty directly to scripts because it helps us disambiguate similar events in different situations. So to go with Ashok's example about receiving the bill right when you sit down at the table, understanding talks about how we can disambiguate that event based on what else has happened before and after. I didn't see the other three as being as applicable to scripts for a couple different reasons. For Generate & Test and Means-Ends Analysis, these are problem solving methods. And as we talked about with planning in the previous exercise, scripts are often used when we already have a solution and we simply need to execute it. Case-Based Reasoning keeps things at the level of individual cases that can be adapted to our current problem. Where as scripts serve as an abstraction over a number of cases. So I don't really see case-based reasoning applying as much here either. >> This is good, David. Thank you for sharing this. Note that Generate and & Test, and Case-Based Reasoning might be able to have the ability to use scripts after all. So one can imagine a situation where there are a large number of scripts available and the robot has to decide which of the scripts should I use for a particular situation. And may not be able to classify the situation dashed into scripts and with that case the robot will pick a script, generate it, try it out, see if it works, if it does not pick another one. Also Case-Based Reasoning is currently the application of scripts in the sense that both Case-Based Reasoning and script-based reasoning are extremely memory intensive. What both of them are saying is that memory often supplies most of the answer. Like we said earlier when we were discussing Case-Based Reasoning, we don't think as much as we think we do. Most of the time memory gives us the answer. The difference, of course, like David pointed out is, that cases defer to instances whereas scripts are abstractions of the instances.
 So how would scripts help inform the design of an agent to solve Raven's progressive matrices? Remember, scripts are ways of making sense of complex events in the world and we can certainly consider individual Raven's matrices to be complex situations. You thus might have a script for different broad categories of Raven's problems. If this was your approach, what would your entry conditions be for each script? What would the tracks be? What would the scenes be? Where are these scripts going to come from? Are you going to tell the agent what script it should use or will it learn a script from prior problems? If the agent succeeds using the script that you give it, who is intelligent? You or your agent?
 So today we've talked about scripts, a complex way of understanding stories in the natural world. Stories aren't just narratives, though. Painting, songs, buildings are all stories of different kinds. Stories are around us every single day. We started off by defining scripts. Scripts are causally coherent series of events. They give a prototype for what to expect in certain situations. The form of the general script shows us the form of the overall prototype for the situation. A specific instantiation of the script then specifies the content. Scripts can have different tracks as well. At a high level, any kind of restaurant involves entering, ordering, paying, and leaving. More narrowly though, fast food and drive through restaurants involve different scripts from casual or formal dining. This concludes our unit on common sense reasoning, but note that some of what we cover in the future will be applicable to learning, differentiating, and refining scripts.
 Scripts are strongly connected to current theories of human cognition. In fact one recent theory says that brain is a predictable machine. We do very quick bottom up processing followed by mostly top down processing with general expectations of the world. Then we act on those expectations. This idea in fact is so strong, that when it fails it leads to amusement, or surprise, or anger. If I violate the expectations of your script, you might find it funny or surprising or you might be upset about it. An interesting and open question is, whether we carry the scripts in our hear or do we generate them at run time? Scripts are also current with the notion of mental models. You and I have mental models, or scripts. Not just about social situations like going to a restaurant, going to a movie, but also about how the computer program works, how the economy works, how the car engine works, your physical, social, economic works. Note that scripts can be culture specific. In the U.S. for example, going to a restaurant typically involves leaving a tip. But in many countries, this is not the case. In fact in some countries, tipping is considered insulting. So scripts presumably evolved through cultural interaction over long periods of time. But once there, they're a very powerful source of knowledge.
 Please write down what you learned in this lesson.
 Great. Thank you so much for your feedback.
